{
    "name": "chat-app-ops",
    "version": "...",
    "author": "...",
    "description": "...",

    "globalconfig": {
        "chatapp": {
            "port": 3000,
            "https_only": true
        }
    },

    "operations": {
        "deploy": {
            "config": {
                "nodejs": {
                    "version": "0.10.26"
                }
            },
            "artifacts": {
                "node.js": {
                    "runner": "chef-solo-runner",
                    "config": {
                        "files": { "nodejs.tar.gz": "http://s3.amazonaws.com/community-files.opscode.com/cookbook_versions/tarballs/4335/original/nodejs.tar.gz?1376517323" },
                        "runlist": [ "recipe[nodejs::default]" ],
                        "nodejs": {
                            "check_sha": false
                        }
                    }
                },
                "run-app": {
                    "runner": "command-runner",
                    "config": {
                        "files": { "run-app.sh": "git://git-server/chatapp.git/scripts/run-app.sh" },
                        "command": "sh ./run-app.sh"
                    }
                },
                "mongodb": {
                    "runner": "chef-solo-runner",
                    "config": {
                        "files": { "mongodb.tar.gz": "http://s3.amazonaws.com/community-files.opscode.com/cookbook_versions/tarballs/6346/original/mongodb.tar.gz?1396423886" },
                        "runlist": [ "recipe[mongodb::default]" ]
                    }
                }
            },
            "dependencies": [
                [ "run-app", "node.js" ],
                [ "run-app", "mongodb" ]
            ],
            "postoptest": {
                "runner": "command-runner",
                "config": {
                    "command": "export RESCODE=$(curl -sL -w \"%{http_code}\\n\" \"http://localhost:3000\" -o /dev/null) && [[ \"$RESCODE\" == \"200\" ]] && true || false"
                }
            }
        }
    }
}
