{
    "name": "chat-app-ops",
    "version": "...",
    "author": "...",
    "description": "...",

    "operations": {
        "deploy": {
            "artifacts": {
                "chat-app": {
                    "runner": "command-runner",
                    "comment": "Node.js 0.10 or better must be installed",
                    "config": {
                        "command": "node app.js"
                    }
                }
            }
        }
    }
}